{
  "journal_id": "POSI-J-000778",
  "metric_year": 2025,
  "pci": null,
  "pci_5yr": null,
  "pnci": null,
  "citable_items": 0,
  "citation_count": 0,
  "total_citations": 1523189,
  "self_citation_rate": null,
  "international": null,
  "status": "insufficient_data",
  "suppression_reason": null,
  "methodology_version": "PCI-1.0",
  "data_cutoff": "2025-12-31",
  "snapshot_date": "2026-08-11",
  "pjr_release": null
}
